{
  "schema_version": "1.0", "id": "ocf-dark", "version": "1.0.0",
  "palette": {"background": "#071426", "foreground": "#F3F8FF", "accent": "#50D8EF", "secondary": "#B294F7", "highlight": "#FFD47B"},
  "logo_variant": "dark", "font": "pillow-aileron", "layout": "cosmic-path",
  "minimum_contrast": 4.5, "effects": {"rings": true, "glow": true}
}
